{
  "dsNombre": "Dataset de Solicitudes Ciudadanas Bogotá 2018-2024",
  "dsEntidadPropietaria": "Secretaría Distrital de Gobierno",
  "dsAreaResponsable": "Dirección de Atención al Ciudadano",
  "dsVersion": "v1.0",
  "dsFechaCreacion": "2025-03-01",
  "dsFechaActualizacion": "",
  "dsContacto": "datagob@bogota.gov.co",
  "dsDescripcion": "Dataset que contiene los registros históricos de PQRS (Peticiones, Quejas, Reclamos y Solicitudes) enviados por ciudadanos a través de canales presenciales, telefónicos y digitales",
  "dsFinalidad": "Entrenar un modelo de IA para clasificar automáticamente las solicitudes por categoría temática y mejorar los tiempos de respuesta",
  "dsProcesosServicios": "Gestión de PQRS, atención al ciudadano, análisis de tendencias",
  "dsFuente": "Sistema 'Bogotá Te Escucha', portal web institucional, red CADE",
  "dsMetodoCaptura": "Registro manual por funcionarios + carga automática vía API del portal",
  "dsFrecuenciaActualizacion": "Actualización diaria",
  "dsNumeroRegistros": "1200000",
  "dsNumeroVariables": "18",
  "dsTiposDatos": "texto libre, fechas, categóricos, identificadores",
  "dsRepresentatividadPoblacional": "Contiene información de las 20 localidades de Bogotá",
  "dsDatosPersonales": "Datos personales incluidos: nombre, correo electrónico, teléfono",
  "dsJustificacion": "Datos necesarios para tramitar las solicitudes conforme a la Ley 1755 y 1437",
  "dsBaseLegal": "Ejercicio de funciones públicas + Ley 1581 de protección de datos",
  "dsDatosFaltantes": "4% en el campo 'descripción'",
  "dsInconsistencias": "formatos incorrectos en 0.7% de correos electrónicos (corregidos)",
  "dsProcesosLimpieza": "eliminación de duplicados, normalización de fechas, validación de campos obligatorios",
  "dsControlesCalidad": "inspección periodica por parte del equipo de calidad",
  "dsValidaciones": "definición de scripts para detección de brechas en la calidad de la información",
  "dsSesgosIdentificados": "Sesgo geográfico: Sobre-representación de Suba y Kennedy. Sesgo demográfico: Menor participación de adultos mayores (5%)",
  "dsDistribucionVariables": "edad, localidad, barrio, estrato",
  "dsRiesgosPoblacionesVulnerables": "El modelo puede tener peor desempeño en localidades rurales o grupos minoritarios",
  "dsLimitaciones": "el uso y adpción de nuevos mecanismos hace que el dato sea impreciso",
  "dsNormalizacion": "corrección de formatos, eliminación de ruido, estandarización de categorías",
  "dsImputacion": "si el dato es opcional se dejará en blanco.",
  "dsBalanceo": "Se aplicarán modelos de machine learning para que el modelo sea efectivo al 8%",
  "dsAnonimizacion": "seudonimización de identificadores antes del entrenamiento",
  "dsRiesgosDiscriminacion": "Posibilidad de que el modelo priorice solicitudes de zonas con mayor conectividad digital",
  "dsRiesgosReidentificacion": "ninguno",
  "dsRiesgosUsoIndebido": "se debe explorar en fase inicial",
  "dsRiesgosSesgosEstructurales": "no aplica",
  "dsRiesgosVulneracionDerechos": "se indetificará con base en los resultados finales del primer mes",
  "dsCumplimientoNormativo": "se establece cumplimiento del tratamiento de datos personales",
  "dsFinalidadAutorizada": "clasificación automática para mejorar tiempos de respuesta, análisis estadístico, informes de gestión",
  "dsRestricciones": "solo se puede usar a través del chatbot",
  "dsUsosIndebidos": "priorización de solicitudes según datos personales, segmentación de ciudadanos, toma de decisiones automatizadas negativas",
  "dsCondicionesAcceso": "restringido al equipo técnico y Comité de IA",
  "dsControlesSeguridad": "registro de acceso, autenticación de doble factor, backups cada 24 horas",
  "dsCifrado": "en tránsito (TLS) y en reposo (AES-256)",
  "dsCustodia": "guardia de seguridad DPO",
  "dsPoliticasAcceso": "control interno al manejar datos sensibles",
  "dsAprobacionEquipoDatos": "Aprobado",
  "dsAprobacionJuridica": "Aprobado",
  "dsAprobacionComiteIA": "Aprobado (Acta 003 - Marzo 2025)",
  "tablaDiccionarioDatos": [
    {
      "Nombre variable": "ID",
      "Descripción": "Identificador único de la solicitud",
      "Tipo de dato": "texto",
      "Valores permitidos / rango": "Alfanumérico",
      "¿Dato personal?": "no",
      "¿Sensible?": "no",
      "Obligatorio": "si",
      "Observaciones": "Clave primaria"
    }
  ],
  "tablaHistorialDataset": [
    {
      "Versión": "v1.0",
      "Fecha": "2025-11-30",
      "Cambios realizados": "Documento Inicial",
      "Responsable": "Dario Gomez"
    }
  ]
}